Plan Name,Discounted Price,Renewal Price,Features
Shared Hosting,$3.19,$9.99,"Unlimited Email Addresses, cPanel Included, Free Domain & SSL, Free Website Builder, Unlimited Bandwidth"
cPanel WordPress,$3.69,Not found,
VPS Hosting,$4.49,$13.99,"Isolated Resources with Hardened Security, Free Website Transfers (with a Control Panel), cPanel and Control Web Panel Available, High-Availability Servers, Cloud-Powered Reliability"
Dedicated Hosting,$35.00,$69.99,"Choose Between Managed With cPanel or Unmanaged Bare Metal, Configurable Server For Ultimate Flexibility, Redundant Infrastructure With 99.99% Uptime"
WordPress Hosting,$3.69,$10.49,"Unlimited Email Addresses, Free Premium Themes & Plugins, Free Domain & SSL, Free Website Builder, PHP-FPM Workers Included"
